{"$id":"https://opengamevcs.dev/schemas/path/v1/conformance-report.schema.json","$schema":"https://json-schema.org/draft/2020-12/schema","additionalProperties":false,"properties":{"capabilities":{"additionalProperties":false,"properties":{"atomicReplace":{"type":"boolean"},"casePreserving":{"type":"boolean"},"caseSensitive":{"type":"boolean"},"directorySync":{"type":"boolean"},"executableBit":{"type":"boolean"},"hardlink":{"type":"boolean"},"normalizationSensitive":{"type":"boolean"},"symlink":{"type":"boolean"}},"required":["atomicReplace","casePreserving","caseSensitive","directorySync","executableBit","hardlink","normalizationSensitive","symlink"],"type":"object"},"contractVersion":{"const":"1.0.0"},"failed":{"minimum":0,"type":"integer"},"implementation":{"additionalProperties":false,"properties":{"name":{"maxLength":128,"minLength":1,"type":"string"},"runtime":{"maxLength":256,"minLength":1,"type":"string"},"version":{"maxLength":64,"minLength":1,"type":"string"}},"required":["name","version","runtime"],"type":"object"},"manifestSha256":{"pattern":"^[0-9a-f]{64}$","type":"string"},"passed":{"minimum":0,"type":"integer"},"platform":{"enum":["linux","macos","windows"]},"registrySetSha256":{"pattern":"^[0-9a-f]{64}$","type":"string"},"results":{"items":{"additionalProperties":false,"properties":{"actualSha256":{"pattern":"^[0-9a-f]{64}$","type":"string"},"category":{"maxLength":64,"minLength":1,"type":"string"},"expectedSha256":{"pattern":"^[0-9a-f]{64}$","type":"string"},"id":{"maxLength":256,"minLength":1,"type":"string"},"passed":{"type":"boolean"}},"required":["id","category","passed","expectedSha256","actualSha256"],"type":"object"},"maxItems":1000,"minItems":1,"type":"array"},"resultsSha256":{"pattern":"^[0-9a-f]{64}$","type":"string"},"schemaVersion":{"const":"ogvcs.path/conformance-report/v1"},"total":{"minimum":1,"type":"integer"},"unicodeCaseFoldingSha256":{"pattern":"^[0-9a-f]{64}$","type":"string"}},"required":["schemaVersion","contractVersion","implementation","platform","capabilities","manifestSha256","registrySetSha256","unicodeCaseFoldingSha256","resultsSha256","total","passed","failed","results"],"title":"OpenGameVCS path/filesystem conformance report","type":"object"}
