{"capabilities":{"atomicReplace":true,"casePreserving":true,"caseSensitive":false,"directorySync":false,"executableBit":false,"hardlink":true,"normalizationSensitive":true,"symlink":true},"contractVersion":"1.0.0","failed":0,"implementation":{"name":"@opengamevcs/path-filesystem","runtime":"node v22.23.2","version":"1.0.0"},"manifestSha256":"2f343e1dac238da527fbd36160419ec6fb53b780ac7e33c01e11acabbdd4782b","passed":78,"platform":"windows","registrySetSha256":"bbabdd95d78cfe0dd9751ab67ccbd9dfa5565bf8c049468aea3129bec787bd42","results":[{"actualSha256":"c15b1335f404dbb3d624f61cae80b93cd67f83f7715b42ab5dbcf90d1acd79fc","category":"path","expectedSha256":"c15b1335f404dbb3d624f61cae80b93cd67f83f7715b42ab5dbcf90d1acd79fc","id":"path:ascii","passed":true},{"actualSha256":"ca04522e127436dab04f832eaf523feec019601e4ca9eb618e8d02e9ed9d51dc","category":"path","expectedSha256":"ca04522e127436dab04f832eaf523feec019601e4ca9eb618e8d02e9ed9d51dc","id":"path:unicode-nfc","passed":true},{"actualSha256":"5770347817495e775becbe3decfdedea9031feb692ea8a803031ca33ff9f4461","category":"path","expectedSha256":"5770347817495e775becbe3decfdedea9031feb692ea8a803031ca33ff9f4461","id":"path:unicode-decomposed","passed":true},{"actualSha256":"4abae4954ce87cc985eefd9b4f48c1288a22ae36c30f656479a54c764a8b622c","category":"path","expectedSha256":"4abae4954ce87cc985eefd9b4f48c1288a22ae36c30f656479a54c764a8b622c","id":"path:empty","passed":true},{"actualSha256":"4abae4954ce87cc985eefd9b4f48c1288a22ae36c30f656479a54c764a8b622c","category":"path","expectedSha256":"4abae4954ce87cc985eefd9b4f48c1288a22ae36c30f656479a54c764a8b622c","id":"path:absolute","passed":true},{"actualSha256":"26f0ba712a3ab6f7b6f3d82566e68ec704802b38b6e3f2cbc26bc03d42ef6a3f","category":"path","expectedSha256":"26f0ba712a3ab6f7b6f3d82566e68ec704802b38b6e3f2cbc26bc03d42ef6a3f","id":"path:empty-segment","passed":true},{"actualSha256":"26f0ba712a3ab6f7b6f3d82566e68ec704802b38b6e3f2cbc26bc03d42ef6a3f","category":"path","expectedSha256":"26f0ba712a3ab6f7b6f3d82566e68ec704802b38b6e3f2cbc26bc03d42ef6a3f","id":"path:dot","passed":true},{"actualSha256":"26f0ba712a3ab6f7b6f3d82566e68ec704802b38b6e3f2cbc26bc03d42ef6a3f","category":"path","expectedSha256":"26f0ba712a3ab6f7b6f3d82566e68ec704802b38b6e3f2cbc26bc03d42ef6a3f","id":"path:dotdot","passed":true},{"actualSha256":"dda7887e47e151b1f0a9a59be31b5b56362863587ddf507dd3bcae988ba61f54","category":"path","expectedSha256":"dda7887e47e151b1f0a9a59be31b5b56362863587ddf507dd3bcae988ba61f54","id":"path:backslash","passed":true},{"actualSha256":"144885d10448ebdbe309005cc9c330f45213cf30b92706f2a1d6f8961214a9d4","category":"path","expectedSha256":"144885d10448ebdbe309005cc9c330f45213cf30b92706f2a1d6f8961214a9d4","id":"path:reserved-control-root","passed":true},{"actualSha256":"144885d10448ebdbe309005cc9c330f45213cf30b92706f2a1d6f8961214a9d4","category":"path","expectedSha256":"144885d10448ebdbe309005cc9c330f45213cf30b92706f2a1d6f8961214a9d4","id":"path:reserved-control-root-case-variant","passed":true},{"actualSha256":"e7f2b5912da791b97c1f4dd34292f3fc6a06d65cf9f6cbedfa10fd01979fe7aa","category":"path","expectedSha256":"e7f2b5912da791b97c1f4dd34292f3fc6a06d65cf9f6cbedfa10fd01979fe7aa","id":"path:windows-con","passed":true},{"actualSha256":"e7f2b5912da791b97c1f4dd34292f3fc6a06d65cf9f6cbedfa10fd01979fe7aa","category":"path","expectedSha256":"e7f2b5912da791b97c1f4dd34292f3fc6a06d65cf9f6cbedfa10fd01979fe7aa","id":"path:windows-nul-extension","passed":true},{"actualSha256":"e7f2b5912da791b97c1f4dd34292f3fc6a06d65cf9f6cbedfa10fd01979fe7aa","category":"path","expectedSha256":"e7f2b5912da791b97c1f4dd34292f3fc6a06d65cf9f6cbedfa10fd01979fe7aa","id":"path:windows-superscript","passed":true},{"actualSha256":"d833d246f6e42a36569e3bf1f3fb51727a603efa88f5adbe34f3f9b954c5d5c2","category":"path","expectedSha256":"d833d246f6e42a36569e3bf1f3fb51727a603efa88f5adbe34f3f9b954c5d5c2","id":"path:windows-trailing-dot","passed":true},{"actualSha256":"d833d246f6e42a36569e3bf1f3fb51727a603efa88f5adbe34f3f9b954c5d5c2","category":"path","expectedSha256":"d833d246f6e42a36569e3bf1f3fb51727a603efa88f5adbe34f3f9b954c5d5c2","id":"path:windows-trailing-space","passed":true},{"actualSha256":"38f462bbbfb582015cdb797b3bae2a811f6c6853562cf2e36d52410e9cdea521","category":"path","expectedSha256":"38f462bbbfb582015cdb797b3bae2a811f6c6853562cf2e36d52410e9cdea521","id":"path:windows-colon","passed":true},{"actualSha256":"b9566b0bae161bf4e26ff97a28a915389205fa2ef4a60d6d3793199583387dcf","category":"path","expectedSha256":"b9566b0bae161bf4e26ff97a28a915389205fa2ef4a60d6d3793199583387dcf","id":"path:linux-colon","passed":true},{"actualSha256":"9e12b08ab72ade67f84a15e706e687fb966b907a11dcb4ad5f8597a4a94dd3a2","category":"path","expectedSha256":"9e12b08ab72ade67f84a15e706e687fb966b907a11dcb4ad5f8597a4a94dd3a2","id":"path:macos-colon","passed":true},{"actualSha256":"8b6a88698427c4ad97dc903bdd5ab87ba5fb5acf785e564e8312f1ef19ad36b8","category":"path","expectedSha256":"8b6a88698427c4ad97dc903bdd5ab87ba5fb5acf785e564e8312f1ef19ad36b8","id":"path:segment-max","passed":true},{"actualSha256":"63b21ec3ab84bb9450b7213dcf6ce38338b4503fb9e2380ff527bd7728313395","category":"path","expectedSha256":"63b21ec3ab84bb9450b7213dcf6ce38338b4503fb9e2380ff527bd7728313395","id":"path:segment-max-plus-one","passed":true},{"actualSha256":"00e61b6bf2cef2960fd3142b15be4a49013a12c385116d44c07c581e59ab8831","category":"path","expectedSha256":"00e61b6bf2cef2960fd3142b15be4a49013a12c385116d44c07c581e59ab8831","id":"path:depth-max","passed":true},{"actualSha256":"41da8dd9d60bba7ad31ca8cb5a7f8d66aa904c68406bb1a2caaf477106d1fce4","category":"path","expectedSha256":"41da8dd9d60bba7ad31ca8cb5a7f8d66aa904c68406bb1a2caaf477106d1fce4","id":"path:depth-max-plus-one","passed":true},{"actualSha256":"1b3d5914f7bc3c1681b39fa28a859781199dde0bbbe0a840f0cf84ca33c764c2","category":"path","expectedSha256":"1b3d5914f7bc3c1681b39fa28a859781199dde0bbbe0a840f0cf84ca33c764c2","id":"path:unknown-profile","passed":true},{"actualSha256":"76aac52f54dbab85c6618730d24a7c2e681ad0931416f6f91c902626a114cf12","category":"path","expectedSha256":"76aac52f54dbab85c6618730d24a7c2e681ad0931416f6f91c902626a114cf12","id":"path:invalid-case-mode","passed":true},{"actualSha256":"2cc2fa3a7c576e6eb63273d2018f5e88afe41b014ffab14b180900133028fbf7","category":"fold","expectedSha256":"2cc2fa3a7c576e6eb63273d2018f5e88afe41b014ffab14b180900133028fbf7","id":"fold:ascii","passed":true},{"actualSha256":"d8f7fa9f1ccb4c5cf8edc46b0ffc3510050bf1899f037e1ff45fbcde8b16d616","category":"fold","expectedSha256":"d8f7fa9f1ccb4c5cf8edc46b0ffc3510050bf1899f037e1ff45fbcde8b16d616","id":"fold:sharp-s","passed":true},{"actualSha256":"f6e53f4bd5d4761913ee8c2993db46cff2e0221d428666abc52889eb67b192bf","category":"fold","expectedSha256":"f6e53f4bd5d4761913ee8c2993db46cff2e0221d428666abc52889eb67b192bf","id":"fold:kelvin","passed":true},{"actualSha256":"d211f1d1edfc89416eec74ea384c13f32a69808a4cace8dd6f5638a74c2b6f70","category":"fold","expectedSha256":"d211f1d1edfc89416eec74ea384c13f32a69808a4cace8dd6f5638a74c2b6f70","id":"fold:greek-sigma","passed":true},{"actualSha256":"0d9765ac4026f92b704ffbe491a9004a6f82d446e2dd3e30dec15c253bfd26fc","category":"fold","expectedSha256":"0d9765ac4026f92b704ffbe491a9004a6f82d446e2dd3e30dec15c253bfd26fc","id":"fold:dotted-i-default","passed":true},{"actualSha256":"e1836fba0514d636a8fb01545db204b1f217d26a86f5de9ec7a64457c9a41ebe","category":"fold","expectedSha256":"e1836fba0514d636a8fb01545db204b1f217d26a86f5de9ec7a64457c9a41ebe","id":"fold:cherokee","passed":true},{"actualSha256":"b79b92a2fc9fb446f09d457bd141a1a7b3af380410b46da034e54f466bdc5e5f","category":"fold","expectedSha256":"b79b92a2fc9fb446f09d457bd141a1a7b3af380410b46da034e54f466bdc5e5f","id":"fold:emoji-invariant","passed":true},{"actualSha256":"dde53d5edea141caf1a689d2234006d6a969d4f45fbef7c6a0a1103386b4acbd","category":"collision","expectedSha256":"dde53d5edea141caf1a689d2234006d6a969d4f45fbef7c6a0a1103386b4acbd","id":"collision:ascii-folded","passed":true},{"actualSha256":"785f94219c05b18d2abf2aa4e4e7f7466afdf14b0ef853de70f37e2d6ac3a2ee","category":"collision","expectedSha256":"785f94219c05b18d2abf2aa4e4e7f7466afdf14b0ef853de70f37e2d6ac3a2ee","id":"collision:ascii-sensitive-linux","passed":true},{"actualSha256":"0227b927862e8711bcd9538014b4a2e04e6751cf2fbfc3748cf21371f8bb884c","category":"collision","expectedSha256":"0227b927862e8711bcd9538014b4a2e04e6751cf2fbfc3748cf21371f8bb884c","id":"collision:ascii-sensitive-windows","passed":true},{"actualSha256":"dde53d5edea141caf1a689d2234006d6a969d4f45fbef7c6a0a1103386b4acbd","category":"collision","expectedSha256":"dde53d5edea141caf1a689d2234006d6a969d4f45fbef7c6a0a1103386b4acbd","id":"collision:sharp-s-folded","passed":true},{"actualSha256":"a055760581becd75294b8a6e49cf60a9e1c4ec6c86f11113c15fa0d1dcff9fd0","category":"collision","expectedSha256":"a055760581becd75294b8a6e49cf60a9e1c4ec6c86f11113c15fa0d1dcff9fd0","id":"collision:different-parent","passed":true},{"actualSha256":"dde53d5edea141caf1a689d2234006d6a969d4f45fbef7c6a0a1103386b4acbd","category":"collision","expectedSha256":"dde53d5edea141caf1a689d2234006d6a969d4f45fbef7c6a0a1103386b4acbd","id":"collision:duplicate-exact","passed":true},{"actualSha256":"e7f2b5912da791b97c1f4dd34292f3fc6a06d65cf9f6cbedfa10fd01979fe7aa","category":"collision","expectedSha256":"e7f2b5912da791b97c1f4dd34292f3fc6a06d65cf9f6cbedfa10fd01979fe7aa","id":"collision:invalid-before-collision","passed":true},{"actualSha256":"cf1b59c71a4d4b0cd1891993e7961e465e2fea5db9c92341339293e5407c3655","category":"preflight","expectedSha256":"cf1b59c71a4d4b0cd1891993e7961e465e2fea5db9c92341339293e5407c3655","id":"preflight:portable-tree","passed":true},{"actualSha256":"efb10c2b136e0d19185feedec3bf47875179a9573ffe026ef67df4db336aa323","category":"preflight","expectedSha256":"efb10c2b136e0d19185feedec3bf47875179a9573ffe026ef67df4db336aa323","id":"preflight:symlink-capability-missing","passed":true},{"actualSha256":"3c978f3206b8b92f2320be3be8c526a6b302